{"bound_inputs":[{"bytes":5355,"git_blob_oid":"3ae07ba551cfc77a8ed3326cd62702be490ce90c","path":"manifests/catalog-maintenance-successor-probe-v1.json","sha256":"sha256:92c7f5bc85a3c8bb6d2a202c47c4027a25c7ce070599986d300148e2fbb28a7f"},{"bytes":14557,"git_blob_oid":"65af7922c7d821f29702d3ec17c46b2aaf525c03","path":"schemas/catalog-maintenance-successor-probe.schema.json","sha256":"sha256:aabffb0cf60a6308e2494b01abd6663cc0fde775b853827cd3f935feba3c0e50"},{"bytes":7273,"git_blob_oid":"5168e007a1b6800e12129ec12ce52f01d4e3cc47","path":"schemas/catalog-maintenance-successor-freeze.schema.json","sha256":"sha256:ac5517fb3930faf4062b3c3316aa2a02d40d44ee994eb41d1602c1a464a24459"},{"bytes":5390,"git_blob_oid":"2d0af239bd12729e900b9e6bcd352956213854f7","path":"schemas/catalog-maintenance-successor-evaluation.schema.json","sha256":"sha256:277f27e808bb1487cfb43a0e30b86a3b62ee6dbed176679ac87d4c0920f4fd9e"},{"bytes":2075,"git_blob_oid":"62e19edc73ed25fd0a810bcde608587ae4059ea1","path":"schemas/catalog-maintenance-successor-decision.schema.json","sha256":"sha256:98f506ae9f627a1530ca2d3c74a150d5e5d1e87da2be9450365f5186b26084bf"},{"bytes":9479,"git_blob_oid":"300783d23f1deb2a91c05ff5c5410ae2d82e1696","path":"docs/17-catalog-prompt-cure-successor.md","sha256":"sha256:f1b75103799e61b74e32368e13bf5926978f3d57d0709461cdc81e5386555b6c"},{"bytes":41317,"git_blob_oid":"c3aab3934968773aaedc0cac23bf3b5554d7465e","path":"src/metis_model1/catalog_maintenance_successor.py","sha256":"sha256:3173596e2c5069b05affb2a447f9de1b51788a31efdd1c368874029721edafcf"},{"bytes":32530,"git_blob_oid":"59157dbd35356829e1f7814b2310e7a84ca0165b","path":"src/metis_model1/catalog_maintenance_successor_evidence.py","sha256":"sha256:beeb31a84c348f327c9a56cf9896123ec4ca42ac28e65422c156ee3d05cde7c8"},{"bytes":108397,"git_blob_oid":"fcc238f5bd969b03be8b7dc8d365df3e1cd34f3e","path":"src/metis_model1/contracts.py","sha256":"sha256:b5de066292c639116442595909c2e4a92b8a59891ade5974e751f4113a5d139e"},{"bytes":5690,"git_blob_oid":"be4ba8dd4e987482d019a64a6c94c8d98d6f507a","path":"tests/test_catalog_maintenance_successor_manifest.py","sha256":"sha256:58a881ec01fabf78d3b81b1bea7ff17d0b45647e68a0e796cb6d02050dc9ba6f"},{"bytes":7845,"git_blob_oid":"f8d7b6af5e90745ae2fcc60118bdd9f7556cc20a","path":"tests/test_catalog_maintenance_successor.py","sha256":"sha256:9c88c90ea42757bf8843b43468e72afc82dcab1cc57fe646ac786d6f45f61f87"},{"bytes":11124,"git_blob_oid":"795c338b1d9f1516755ebaa699b1b1728e12efed","path":"tests/test_catalog_maintenance_successor_evidence.py","sha256":"sha256:5259ba818a20357a62a5e50355f8ffbac133ba5a44499c027efa1cf5a35b2391"},{"bytes":19419,"git_blob_oid":"d91995d72447ea709798ade98dd2db1040f5a574","path":"tests/test_contracts.py","sha256":"sha256:427690ec302745b435b7c0eee5acbce415b887f0dff15057a064b371f468722c"},{"bytes":60400,"git_blob_oid":"c482f3a39f1524dc5a887c8dee1f0d6315e4dcb2","path":"src/metis_model1/catalog_maintenance_probe.py","sha256":"sha256:91b8f6828b773a36186af91d64a895fb4bba5040a4371a7df8fae28173ff47a8"},{"bytes":27379,"git_blob_oid":"b6a1dd3a95eee31bcc0bf8e44ad4d3564891074d","path":"src/metis_model1/catalog_maintenance_pin.py","sha256":"sha256:6f105adbeef370a597698b051ce7a9eeda27d1939e1a0ef7b9dae18ebdeb1528"},{"bytes":23175,"git_blob_oid":"814e138e23c0b0fcc362db126053fce6619fae48","path":"src/metis_model1/catalog_retrieval.py","sha256":"sha256:bca79ebd6e4b38e6d41da78b90dcab5929674d2c272ba8f213a5ebdf1cd0dd58"},{"bytes":30765,"git_blob_oid":"ad4080e261dd562a2bb1f72b5b3149f0c2ffccc5","path":"src/metis_model1/catalog_retrieval_refresh.py","sha256":"sha256:a3ebc7d3377f158c4901f856fb8807c155624fe384086560e9c4e9818ce23859"},{"bytes":111749,"git_blob_oid":"05526054d3672ff68ce16a3f73f007e304845fc7","path":"src/metis_model1/oracles.py","sha256":"sha256:0b66dcd00b6b6a44109621f9b304e7fecc125a5086a28b738d463a6751ecbc69"},{"bytes":6052,"git_blob_oid":"01c333aee1e5902017b0977958c52b7b16989da3","path":"manifests/catalog-retrieval-public-synthetic-v1.json","sha256":"sha256:203ed68a1574c869910fc0b096cfa3a760a3e0b6857a9fb89d1902d582241bb2"},{"bytes":7256,"git_blob_oid":"69c3704dc26be0f2bd3684de101f69f8f7cb4594","path":"manifests/catalog-retrieval-execution-v1.json","sha256":"sha256:dd5a2b3046842dba35bffd06111882caafe52c66d80bd1f0d3b7c3a7d911ea5b"},{"bytes":5481,"git_blob_oid":"37a16839abb27cffab751ca34544dd51599ac199","path":"schemas/catalog-retrieval-execution-receipt.schema.json","sha256":"sha256:22d90adf2ad28eaaf81285dccbd29058311573c1e8dd71bac4fd3c2edf0e8046"},{"bytes":6056,"git_blob_oid":"65ec752f64058e1534edb04c102939d47734b1c2","path":"manifests/catalog-maintenance-pin-v1.json","sha256":"sha256:04c8dff417b14bbc08bc291e8d6de0039a958d08f7f4ac8fc2e99a671fc902ea"},{"bytes":4066,"git_blob_oid":"5ec389ab47d9de66d8047b76ff446aa851770819","path":"schemas/catalog-maintenance-pin.schema.json","sha256":"sha256:3a0d70e142f92cae42497ca62402fcffa72c5efd4a7a25f995a1d5434273c01a"},{"bytes":430,"git_blob_oid":"c1c688b8267f6492324a677968d411af179fac67","path":"fixtures/catalog-maintenance/public-synthetic-v1/catalogs/aa-video.metis","sha256":"sha256:a248ac46ff3a6bb2025db73aba44d3e6d12a03d2b0e8d38980d700afb78a13c5"},{"bytes":110,"git_blob_oid":"e854bb4a5e64f6615e471cfa3c1c4a6904c39d24","path":"fixtures/catalog-maintenance/public-synthetic-v1/catalogs/bb-people.metis","sha256":"sha256:99ec9eea3040ec1a0da12edff615cc64fd5b9c37cd5d99c9d9b306b4579f164a"},{"bytes":68,"git_blob_oid":"c57048ebdabd12e86a194f90d8755d68bbb565dc","path":"fixtures/catalog-maintenance/public-synthetic-v1/metis.toml","sha256":"sha256:66b8c89ddcd2b86c26baa552c6eaa7201b94a50f89d5e9949cdd8ebfe3fbc56a"},{"bytes":58,"git_blob_oid":"818af59a47a9189dd865ecd8174fd83095a5786a","path":"fixtures/catalog-maintenance/public-synthetic-v1/values/aa-list.metis","sha256":"sha256:6946887b44f9881e62430acb901549ce14e7e704104785ce233b3e64e889eafb"},{"bytes":112,"git_blob_oid":"9da579c59039f94ad87069f529b8bc75fbf15d8b","path":"fixtures/catalog-maintenance/public-synthetic-v1/values/bb-reflected.metis","sha256":"sha256:beceb53fe9827c315ed5fddd850070494912e94526aeeab03b346b7a9c106e83"},{"bytes":65,"git_blob_oid":"cb21969fe0af6d588100c8cc196e3f25ddd4ae11","path":"fixtures/catalog-maintenance/public-synthetic-v1/values/cc-editorial.metis","sha256":"sha256:0dc95385e21dc870cabaf7738fbf9fe146d823922f938c491dd5070bdd7bcb6a"},{"bytes":2045,"git_blob_oid":"858e2ada2172770f01bca8513a3db548c64c4849","path":"fixtures/catalog-maintenance/successor-v1/cases/author-audience-enum5.json","sha256":"sha256:018f13629231b8546e1873c03f3777b82c634c1e60af3a5159a49b28f4cab1aa"},{"bytes":2098,"git_blob_oid":"9d71dd7def51b5e64694eff92e3e72195b22a8ab","path":"fixtures/catalog-maintenance/successor-v1/cases/author-availability-inline.json","sha256":"sha256:600ee88c93f115adc972c3db6eedc226ae0eba6c2546c8e648afb5407fc04c2b"},{"bytes":2057,"git_blob_oid":"d2382098e484216d8b30e25ceb4fa842f4c11406","path":"fixtures/catalog-maintenance/successor-v1/cases/author-nested-code-enum4.json","sha256":"sha256:95b5dcbc381a96b61164b9180f50995cc326dfa3a045d477092abc81c71a27bf"},{"bytes":1985,"git_blob_oid":"7bf5acd139e0d43351cf6190869c1ce76690e0ec","path":"fixtures/catalog-maintenance/successor-v1/cases/author-summary-open.json","sha256":"sha256:364a6b6ef6d5e4604f7b6ba1542be694bd1bd8dfde42f1f80043d40a16a10e4b"},{"bytes":2250,"git_blob_oid":"6165a3ce4d5c8dc478701134b5052a52effe2a55","path":"fixtures/catalog-maintenance/successor-v1/cases/edit-category-inline3-to-enum3.json","sha256":"sha256:9827e3582fad9454f1ff5e2d56c0fb43873c54ad31f4f2c1cf75e9d3366bc744"},{"bytes":2146,"git_blob_oid":"f0ec28a4ce784ebf012421e581e623a4cd0d7e4a","path":"fixtures/catalog-maintenance/successor-v1/cases/edit-invalid-query-open.json","sha256":"sha256:998829ac22b699e977c25c023e04dbcad4cdaec622fffb84a739cf577c67f59a"},{"bytes":2715,"git_blob_oid":"ab220f7e1b0b42254f7e74edf1f656ce829d9594","path":"fixtures/catalog-maintenance/successor-v1/cases/edit-retrieval-curated-not-inline.json","sha256":"sha256:53898a5c68cea4e13625a71c4652e98369fe591aed969ee9c24f2e4e4c40b8cb"},{"bytes":2279,"git_blob_oid":"6fdf4389aa4f23ad6b3c294c595f441592dd8246","path":"fixtures/catalog-maintenance/successor-v1/cases/repair-tags-unsynchronized-enum3.json","sha256":"sha256:1486899e173512b9b4edace823b00784e3652b03fdca5eb5a214b5298b6c8a50"}],"catalog_pin":{"manifest_sha256":"sha256:0e3a4d9050f7ee9d6584fb284a0671f0e0eaf398597be29806943d7b6bffa987","revision":"5e112f9148f40e7e792052e896c5a9efe8eaf0a2","tree":"41c7a2b6890fa42d8123bd93f6560d0b9bfae8af","verification":"verified_local_cooperative"},"checkpoint":{"auxiliary_files":[{"bytes":1570,"ctime_ns":1787230960958678260,"device":16777234,"inode":235805542,"mtime_ns":1787230960957968215,"path":".gitattributes","sha256":"sha256:34448b82c17d60fec9b65b1f093c115ddbaadc04beb1b0140b6bfed2e012a930"},{"bytes":632,"ctime_ns":1787230961103002007,"device":16777234,"inode":235805552,"mtime_ns":1787230961102287295,"path":"README.md","sha256":"sha256:860ff845b4746d0b3e1d1afa4f13aac691ef49c7165054cedfb199371568c4c2"},{"bytes":8952,"ctime_ns":1787230960958738011,"device":16777234,"inode":235805540,"mtime_ns":1787230960958152174,"path":"chat_template.jinja","sha256":"sha256:c3cf9e34abf4f9e36c2d72165aa9c132d3e2a725b6c2586aaa3a8af9d7a81041"},{"bytes":4932,"ctime_ns":1787230960733673037,"device":16777234,"inode":235805533,"mtime_ns":1787230960733653662,"path":"config.json","sha256":"sha256:14b65a0ee06517060a6bbd979bb1a8ff54e7b304b1a1f01d54344b88b8285e85"},{"bytes":202,"ctime_ns":1787230960931715879,"device":16777234,"inode":235805541,"mtime_ns":1787230960931695295,"path":"generation_config.json","sha256":"sha256:e70c136c1b78ddc1fb0905bac8e733a4dc448d4f852a5dd75143fffc70be550e"},{"bytes":218281,"ctime_ns":1787230960894776657,"device":16777234,"inode":235805536,"mtime_ns":1787230960893975486,"path":"model.safetensors.index.json","sha256":"sha256:13b840162b4cb35c66fef7df072f7dbb4717908204364f5e5d9f9655a2758fa8"},{"bytes":390,"ctime_ns":1787230961068605797,"device":16777234,"inode":235805553,"mtime_ns":178